{
  "schema_version": "3.0.0",
  "content_version": "0.4.3",
  "mapping_set_id": "cms_cn_moe_senior_high_biology_2020_outcomes",
  "framework_id": "cfw_cn_moe_senior_high_biology_2020_outcomes",
  "curriculum_id": "cur_cn_moe_senior_high_biology_2020",
  "subject": "Biology",
  "mapping_scope": "outcome_coverage",
  "source_ids": [
    "src_cn_moe_senior_high_biology_2025"
  ],
  "generated_at": "2026-07-19",
  "review_status": "approved",
  "changelog": [
    {
      "version": "0.1.0",
      "date": "2026-07-18",
      "summary_zh": "建立主题级候选映射。"
    },
    {
      "version": "0.2.1",
      "date": "2026-07-18",
      "summary_zh": "复核主题边界和跨层级误映射。"
    },
    {
      "version": "0.3.0",
      "date": "2026-07-19",
      "summary_zh": "替换为 120 个编号成果的保守映射。"
    },
    {
      "version": "0.4.0",
      "date": "2026-07-19",
      "summary_zh": "应用全库定义复核与缺口解析：118 项知识成果闭合为 full，2 项纯价值与社会责任成果保持 excluded。"
    },
    {
      "version": "0.4.1",
      "date": "2026-10-25",
      "summary_zh": "按 2026-10-25 官方来源复核更新证据定位（中国课标迁至 2025 日常修订版、新加坡页码校正），状态保持 needs_review。"
    },
    {
      "version": "0.4.2",
      "date": "2026-10-25",
      "summary_zh": "依据 2026-10 联网复核修正描述、证据定位与映射覆盖，状态保持 needs_review。"
    },
    {
      "version": "0.4.3",
      "date": "2026-10-25",
      "summary_zh": "完成联网复核与人工批准。"
    }
  ],
  "mappings": [
    {
      "mapping_id": "map_cn_sh_bio_2020_o_rc_1_1_1_cellular_elements_carbon_skeletons",
      "requirement_id": "req_cn_sh_bio_2020_o_rc_1_1_1_cellular_elements_carbon_skeletons",
      "canonical_ids": [
        "pc_fa5e5c389a8f790944f2e6049357654b",
        "pc_b010170fadec4b31174da9a87a4332e1"
      ],
      "coverage_status": "full",
      "relation": "required",
      "mapping_basis": "semantic_inference",
      "confidence": "high",
      "rationale_zh": "经定义边界复核，现由 canonical 概念 pc_fa5e5c389a8f790944f2e6049357654b、pc_b010170fadec4b31174da9a87a4332e1 完整覆盖。",
      "evidence_refs": [
        {
          "source_id": "src_cn_moe_senior_high_biology_2025",
          "locator": "生物学标准PDF p.16（正文对应内容要求 1.1.1），必修·分子与细胞"
        }
      ],
      "review_status": "approved"
    },
    {
      "mapping_id": "map_cn_sh_bio_2020_o_rc_1_1_2_cellular_water",
      "requirement_id": "req_cn_sh_bio_2020_o_rc_1_1_2_cellular_water",
      "canonical_ids": [
        "pc_63dfa087168bfb9834409155d515790e"
      ],
      "coverage_status": "full",
      "relation": "required",
      "mapping_basis": "semantic_inference",
      "confidence": "high",
      "rationale_zh": "现有 canonical 概念组合与该诊断成果的定义和课程深度一致。",
      "evidence_refs": [
        {
          "source_id": "src_cn_moe_senior_high_biology_2025",
          "locator": "生物学标准PDF p.16（正文对应内容要求 1.1.2），必修·分子与细胞"
        }
      ],
      "review_status": "approved"
    },
    {
      "mapping_id": "map_cn_sh_bio_2020_o_rc_1_1_3_cellular_inorganic_salts",
      "requirement_id": "req_cn_sh_bio_2020_o_rc_1_1_3_cellular_inorganic_salts",
      "canonical_ids": [
        "pc_c088a7df0656c7e3658e30f9fda3d609"
      ],
      "coverage_status": "full",
      "relation": "required",
      "mapping_basis": "semantic_inference",
      "confidence": "high",
      "rationale_zh": "经定义边界复核，现由 canonical 概念 pc_c088a7df0656c7e3658e30f9fda3d609 完整覆盖。",
      "evidence_refs": [
        {
          "source_id": "src_cn_moe_senior_high_biology_2025",
          "locator": "生物学标准PDF p.16（正文对应内容要求 1.1.3），必修·分子与细胞"
        }
      ],
      "review_status": "approved"
    },
    {
      "mapping_id": "map_cn_sh_bio_2020_o_rc_1_1_4_carbohydrate_roles",
      "requirement_id": "req_cn_sh_bio_2020_o_rc_1_1_4_carbohydrate_roles",
      "canonical_ids": [
        "pc_d2d44c20526a3ef06addda76bd0c3a1a"
      ],
      "coverage_status": "full",
      "relation": "required",
      "mapping_basis": "semantic_inference",
      "confidence": "high",
      "rationale_zh": "现有 canonical 概念组合与该诊断成果的定义和课程深度一致。",
      "evidence_refs": [
        {
          "source_id": "src_cn_moe_senior_high_biology_2025",
          "locator": "生物学标准PDF p.16（正文对应内容要求 1.1.4），必修·分子与细胞"
        }
      ],
      "review_status": "approved"
    },
    {
      "mapping_id": "map_cn_sh_bio_2020_o_rc_1_1_5_lipid_roles",
      "requirement_id": "req_cn_sh_bio_2020_o_rc_1_1_5_lipid_roles",
      "canonical_ids": [
        "pc_a25a3778f32928001d458246f6e48696"
      ],
      "coverage_status": "full",
      "relation": "required",
      "mapping_basis": "semantic_inference",
      "confidence": "high",
      "rationale_zh": "现有 canonical 概念组合与该诊断成果的定义和课程深度一致。",
      "evidence_refs": [
        {
          "source_id": "src_cn_moe_senior_high_biology_2025",
          "locator": "生物学标准PDF p.16（正文对应内容要求 1.1.5），必修·分子与细胞"
        }
      ],
      "review_status": "approved"
    },
    {
      "mapping_id": "map_cn_sh_bio_2020_o_rc_1_1_6_protein_structure_function",
      "requirement_id": "req_cn_sh_bio_2020_o_rc_1_1_6_protein_structure_function",
      "canonical_ids": [
        "pc_e6ccc14f032828a2848774a7431ee682",
        "pc_fa5e5c389a8f790944f2e6049357654b"
      ],
      "coverage_status": "full",
      "relation": "required",
      "mapping_basis": "semantic_inference",
      "confidence": "high",
      "rationale_zh": "现有 canonical 概念组合与该诊断成果的定义和课程深度一致。",
      "evidence_refs": [
        {
          "source_id": "src_cn_moe_senior_high_biology_2025",
          "locator": "生物学标准PDF p.16（正文对应内容要求 1.1.6），必修·分子与细胞"
        }
      ],
      "review_status": "approved"
    },
    {
      "mapping_id": "map_cn_sh_bio_2020_o_rc_1_1_7_nucleic_acids_information",
      "requirement_id": "req_cn_sh_bio_2020_o_rc_1_1_7_nucleic_acids_information",
      "canonical_ids": [
        "pc_6a00c0df14c5b18459964bd5ccb5c243",
        "pc_7c8644ecf9e964364af575d584241cf8",
        "pc_fa5e5c389a8f790944f2e6049357654b"
      ],
      "coverage_status": "full",
      "relation": "required",
      "mapping_basis": "semantic_inference",
      "confidence": "high",
      "rationale_zh": "现有 canonical 概念组合与该诊断成果的定义和课程深度一致。",
      "evidence_refs": [
        {
          "source_id": "src_cn_moe_senior_high_biology_2025",
          "locator": "生物学标准PDF p.16（正文对应内容要求 1.1.7），必修·分子与细胞"
        }
      ],
      "review_status": "approved"
    },
    {
      "mapping_id": "map_cn_sh_bio_2020_o_rc_1_2_1_plasma_membrane_functions",
      "requirement_id": "req_cn_sh_bio_2020_o_rc_1_2_1_plasma_membrane_functions",
      "canonical_ids": [
        "pc_5ff2cda97c05cbe449e6d6bcff0c0834",
        "pc_7f67c92fa0c79a54f0822060ac8a4080"
      ],
      "coverage_status": "full",
      "relation": "required",
      "mapping_basis": "semantic_inference",
      "confidence": "high",
      "rationale_zh": "经定义边界复核，现由 canonical 概念 pc_5ff2cda97c05cbe449e6d6bcff0c0834、pc_7f67c92fa0c79a54f0822060ac8a4080 完整覆盖。",
      "evidence_refs": [
        {
          "source_id": "src_cn_moe_senior_high_biology_2025",
          "locator": "生物学标准PDF p.16（正文对应内容要求 1.2.1），必修·分子与细胞"
        }
      ],
      "review_status": "approved"
    },
    {
      "mapping_id": "map_cn_sh_bio_2020_o_rc_1_2_2_organelle_functions",
      "requirement_id": "req_cn_sh_bio_2020_o_rc_1_2_2_organelle_functions",
      "canonical_ids": [
        "pc_cb341a51c60bb212ac55750a84630c03"
      ],
      "coverage_status": "full",
      "relation": "required",
      "mapping_basis": "semantic_inference",
      "confidence": "high",
      "rationale_zh": "现有 canonical 概念组合与该诊断成果的定义和课程深度一致。",
      "evidence_refs": [
        {
          "source_id": "src_cn_moe_senior_high_biology_2025",
          "locator": "生物学标准PDF p.16-17（正文对应内容要求 1.2.2），必修·分子与细胞"
        }
      ],
      "review_status": "approved"
    },
    {
      "mapping_id": "map_cn_sh_bio_2020_o_rc_1_2_3_nucleus_genetic_information",
      "requirement_id": "req_cn_sh_bio_2020_o_rc_1_2_3_nucleus_genetic_information",
      "canonical_ids": [
        "pc_6a00c0df14c5b18459964bd5ccb5c243",
        "pc_cb341a51c60bb212ac55750a84630c03",
        "pc_f25b23ea81c506e587d3067e86866c09"
      ],
      "coverage_status": "full",
      "relation": "required",
      "mapping_basis": "semantic_inference",
      "confidence": "high",
      "rationale_zh": "经定义边界复核，现由 canonical 概念 pc_6a00c0df14c5b18459964bd5ccb5c243、pc_cb341a51c60bb212ac55750a84630c03、pc_f25b23ea81c506e587d3067e86866c09 完整覆盖。",
      "evidence_refs": [
        {
          "source_id": "src_cn_moe_senior_high_biology_2025",
          "locator": "生物学标准PDF p.17（正文对应内容要求 1.2.3），必修·分子与细胞"
        }
      ],
      "review_status": "approved"
    },
    {
      "mapping_id": "map_cn_sh_bio_2020_o_rc_1_2_4_organelle_coordination",
      "requirement_id": "req_cn_sh_bio_2020_o_rc_1_2_4_organelle_coordination",
      "canonical_ids": [
        "pc_cb341a51c60bb212ac55750a84630c03",
        "pc_78dd182e4fbad59e57aeb4484e1c3954"
      ],
      "coverage_status": "full",
      "relation": "required",
      "mapping_basis": "semantic_inference",
      "confidence": "high",
      "rationale_zh": "经定义边界复核，现由 canonical 概念 pc_cb341a51c60bb212ac55750a84630c03、pc_78dd182e4fbad59e57aeb4484e1c3954 完整覆盖。",
      "evidence_refs": [
        {
          "source_id": "src_cn_moe_senior_high_biology_2025",
          "locator": "生物学标准PDF p.17（正文对应内容要求 1.2.4），必修·分子与细胞"
        }
      ],
      "review_status": "approved"
    },
    {
      "mapping_id": "map_cn_sh_bio_2020_o_rc_1_3_1_cellular_unity_diversity",
      "requirement_id": "req_cn_sh_bio_2020_o_rc_1_3_1_cellular_unity_diversity",
      "canonical_ids": [
        "pc_64852ab0501ee4d7b32d11655eb6b808"
      ],
      "coverage_status": "full",
      "relation": "required",
      "mapping_basis": "semantic_inference",
      "confidence": "high",
      "rationale_zh": "经定义边界复核，现由 canonical 概念 pc_64852ab0501ee4d7b32d11655eb6b808 完整覆盖。",
      "evidence_refs": [
        {
          "source_id": "src_cn_moe_senior_high_biology_2025",
          "locator": "生物学标准PDF p.17（正文对应内容要求 1.3.1），必修·分子与细胞"
        }
      ],
      "review_status": "approved"
    },
    {